Название;Место;Дата проведения;Организатор;Ссылка
День технолога 3.0 - онлайн-форум производителей лакокрасочных материалов и сухих строительных смесей;Онлайн, Веб; с 8 по 10 июня ;Aforum;https://expomap.ru/expo-b/click/6593//
Перспективы развития Большого порта Санкт-Петербург 2021 - международная конференция;Россия, Санкт-Петербург , Конгресс-центр «Ленполиграфмаш»; с 9 по 10 июня ;"Журнал ""Вести морского Петербурга"" (ООО ""Морской Петербург"")";https://expomap.ru/conference/perspektivy-razvitija-bolshogo-porta-sankt-peterburg-2021/
Налоговый мониторинг 2021 - конференция;Россия, Москва; 10 июня 2021 ;CFO-Russia, группа Prosperity Media;https://expomap.ru/conference/nalogovyj-monitoring-2021/
Energie-Tage St.Gallen Summer 2021 - конгресс по энергетике;Швейцария, Санкт-Галлен , Olma Messen St.Gallen; 11 июня 2021 ;Genossenschaft Olma Messen St.Gallen;https://expomap.ru/conference/energie-tage-stgallen-summer-2021/
Asian And Oceanian Myology Center Meeting (AOMC) 2021 - симпозиум неврологов;Южная Корея, Пусан; с 10 по 12 июня ;FTC Events;https://expomap.ru/conference/asian-and-oceanian-myology-center-meeting-aomc-2021/
funds excellence 2021 - конференция по финансам и инвестициям;Германия, Франкфурт , Kap Europa; 15 июня 2021 ;funds excellence GmbH;https://expomap.ru/conference/funds-excellence-2021/
Zukunftskongress Staat & Verwaltung 2021 - конференция по административной модернизации и электронному правительству;Германия, Берлин; с 14 по 16 июня ;Wegweiser Media & Conferences GmbH;https://expomap.ru/conference/zukunftskongress-staat-verwaltung-2021/
American Worlds Water Association Annual Conference & Exposition 2021 - международная выставка и конференция по вопросам сохранения чистой питьевой воды;США, Сан-Диего; с 13 по 16 июня ;American Water Works Association USA;https://expomap.ru/conference/american-worlds-water-association-annual-conference-exposition-2021/
Catalysis for Renewable Sources: Fuel, Energy, Chemicals (CRS) 2021 - конференция по каталитической химии;Португалия, Лиссабон , Conference Centre of the Riviera Hotel Carcavelos; с 14 по 16 июня ;Институт катализа СО РАН;https://expomap.ru/conference/catalysis-for-renewable-sources-fuel-energy-chemicals-crs-2021/
Kyiv iGaming Affiliate Conference 2021 - конференция  легализации игорной деятельности;"Украина, Киев , Конференц-холл ""Оазис"""; 16 июня 2021 ;Smile-Expo;https://expomap.ru/conference/kyiv-igaming-affiliate-2021/
Общие центры обслуживания: организация и развитие 2021 - конференция;Россия, Санкт-Петербург; с 16 по 18 июня ;CFO-Russia, группа Prosperity Media;https://expomap.ru/conference/obschie-tsentryi-obsluzhivaniya-organizatsiya-i-razvitie-2021/
ISSN Annual Conference and Expo 2021 - конференция по спортивному питанию;США, Сент-Питерсберг , Hilton St. Petersburg Bayfront; с 17 по 19 июня ;International Society Of Sports Nutrition, ISSN USA;https://expomap.ru/conference/issn-annual-conference-and-expo-2021/
Face and Body Surgery Congress 2021 - международная конференция по эстетической и реконструктивной хирургии;Великобритания, Лондон , The Royal Society of Medicine; с 18 по 19 июня ;MA Exhibitions Ltd;https://expomap.ru/conference/face-and-body-surgery-congress-2021/
Контроль и проверки бизнеса налоговыми органами. Методы правовой защиты 2021 - бизнес-семинар;Россия, Ростов-на-Дону , ул. Лермонтовская, 104; с 18 по 19 июня ;Профессиональные образовательные технологии;https://expomap.ru/conference/kontrol-i-proverki-biznesa-nalogovymi-organami-metody-pravovoj-zaschity-2021/
MICE Нетворкинг Форум РСВЯ. Лето 2021 - форум и общее собрание членов РСВЯ;Россия, Уфа , ВДНХ-ЭКСПО; с 17 по 19 июня ;РСВЯ;https://expomap.ru/conference/mice-netvorking-forum-rsvja-leto-2021/
Trans-Atlantic Plastic Surgery Summit 2021 - саммит трансатлантических пластических хирургов;Исландия, Рейкьявик , HARPA Concert Hall and Conference Centre; с 18 по 20 июня ;CP Reykjavik;https://expomap.ru/conference/trans-atlantic-plastic-surgery-summit-2021/
Мультидисциплинарная эстетическая медицина 2021 - международный конгресс (оффлайн+онлайн);Россия, Санкт-Петербург , Отель «Санкт-Петербург»; с 17 по 20 июня ;"""Человек и его здоровье""";https://expomap.ru/conference/multidistsiplinarnaja-esteticheskaja-meditsina-2021/
3D CONF - Три Дня До Дедлайна 2021 - rонференция digital-агентств и студий (оффлайн+онлайн);Россия, Санкт-Петербург , Holiday Inn St. Petersburg / Moskovskye Vorota; с 19 по 20 июня ;Event-маркетинг от А до Я;https://expomap.ru/conference/3d-conf-tri-dnja-do-dedlajna-2021/
IATEFL 2020 - международная образовательная конференция и выставка;Великобритания, Харрогейт; с 16 по 19 марта с 19 по 22 июня ;IATEFL UK;https://expomap.ru/conference/iatefl-2020/
International Conference on Applied Computing & Information Technology (ACIT) 2021 - международная конференция по прикладным вычислениям и информационным технологиям;Япония, Канандзава , Kanazawa New Grand Hotel; с 20 по 22 июня ;International Association for Computer and Information Science (ACIS);https://expomap.ru/conference/international-conference-on-applied-computing-information-technology-acit-2021/
M-Enabling Summit 2021 - глобальная встреча по доступности мобильных технологий для пожилых и людей с ограниченными возможностями;США, Вашингтон; с 21 по 23 июня ;E.J. Krause & Associates, Inc.;https://expomap.ru/conference/m-enabling-summit-2021/
SHRM 2021 - конференция и выставка;США, Лас-Вегас , McСormick Place; с 20 по 23 июня ;SHRM;https://expomap.ru/conference/shrm-2021/
World of Photonics Congress 2021 - всемирный конгресс по фотонике;Германия, Мюнхен , messe-muenchen; с 20 по 24 июня ;Messe Munchen GmbH;https://expomap.ru/conference/world-of-photonics-congress-2021/
Canadian Bioeconomy 2021 - международная конференция и выставка по биоэнергетике;Канада, Принс-Джордж; с 23 по 24 июня ;Canadian Biomass Canada;https://expomap.ru/conference/canadian-bioeconomy-2021/
World Hydrogen Technologies Convention (WHTS) 2021 - всемирная конвенция по водородным технологиям;Канада, Монреаль; с 20 по 24 июня ;Peter Sauber Agentur Messen und Kongresse GmbH;https://expomap.ru/conference/world-hydrogen-technologies-convention-whts-2021/
Международное налоговое планирование. Июнь 2021 - конференция;Россия, Москва; 24 июня 2021 ;CFO-Russia, группа Prosperity Media;https://expomap.ru/conference/mezhdunarodnoe-nalogovoe-planirovanie-june-2021/
Apple Tech Business Week 2021 - деловая IT-конференция;Россия, Санкт-Петербург , Resonance Space; с 22 по 24 июня ;NBCom Group;https://expomap.ru/conference/apple-tech-business-week-2021/
Mind the Product Hamburg 2021 - конференция по продакт-менеджменту;Германия, Гамбург; с 23 по 25 июня ;Mind the Product Ltd.;https://expomap.ru/conference/mind-the-product-hamburg-2021/
NFPA 2021 - всемирная конференция и выставка национальной ассоциации противопожарной защиты;США, Лас-Вегас , Mandalay Bay Convention Center; с 22 по 25 июня ;ROC Exhibitions, Inc.;https://expomap.ru/conference/nfpa-2021/
Global Forum on Nursing and Healthcare 2021 - конференция по сестринскому делу;Германия, Берлин; с 24 по 25 июня ;Conference Series LLC (Europe & Middle East) UK;https://expomap.ru/conference/global-forum-on-nursing-and-healthcare-2021/
Seymartec Mining. Эффективность горнодобывающей промышленности 2021 - международный форум;Россия, Нижний Тагил , Отель «Демидов Плаза»; с 23 по 25 июня ;Сеймартек;https://expomap.ru/conference/seymartec-miningmetal-gorno-metallurgicheskij-forum-2021/
Client Service Forum 2021 - всероссийский форум по клиентскому сервису;Россия, Москва , Холидей Инн Москва Сущевский; с 23 по 25 июня ;Interforum;https://expomap.ru/conference/client-service-forum-2021/
SmartTransport 2021 - петербургский инновационный форум пассажирского транспорта;Россия, Санкт-Петербург , ЭкспоФорум; с 23 по 25 июня ;ЭкспоФорум-Интернэшнл;https://expomap.ru/conference/smarttransport-2021/
Тепличная отрасль 2021 - сельскохозяйственный форум;Россия, Краснодар , Four Points by Sheraton; 25 июня 2021 ;Журнал Агробизнес;https://expomap.ru/conference/teplichnaja-otrasl-2021/
InfoSpace 2021 - форум инновационных технологий;Россия, Москва , Центр цифрового лидерства; 25 июня 2021 ;АНО Центр поддержки и развития бизнеса «Инициатива»;https://expomap.ru/conference/infospace-2021/
Евразийский Ортопедический Форум 2021 - международный форум по ортопедии, травматологии и экономики здравоохранения (оффлайн+онлайн);"Россия, Москва , Технопарк ""Сколково"""; с 25 по 26 июня ;Евразийский Ортопедический Форум;https://expomap.ru/conference/evrazijskij-ortopedicheskij-forum-2021/
Белая конфа 2021 - конференция по проблемам онлайн-образования (оффлайн+онлайн);Россия, Санкт-Петербург , Holiday Inn St. Petersburg Moskovskye Vorota; с 26 по 28 июня ;Event-маркетинг от А до Я;https://expomap.ru/conference/belaja-konfa-2021/
Retail Shopfitting & Display Summit 2021 - саммит по розничной торговле (оффлайн+онлайн);Великобритания, Лондон , Radisson Red London Heathrow; с 8 по 9 марта с 28 по 29 июня ;Forum Events Limited;https://expomap.ru/conference/retail-shopfitting-display-summit-2021/
Facilities Management (FM) Forum Hybrid 2021 - форум по управлению и эксплуатации объектов недвижимости (оффлайн+онлайн);Великобритания, Лондон; с 28 по 29 июня ;Forum Events Limited;https://expomap.ru/conference/facilities-management-fm-forum-hybrid-2021/
ISS World Middle East 2021 - международная конференция и выставка систем и технологий сбора данных, разведки и криминалистики;ОАЭ, Дубай , JW Mariott; с 1 по 3 марта с 28 по 30 июня ;TeleStrategies;https://expomap.ru/conference/iss-world-middle-east-2021/
Мать и Дитя 2021 - региональный научно-образовательный форум и пленум правления РОАГ (оффлайн+онлайн);Россия, Москва , ФГБУ «НМИЦ АГП им. В.И. Кулакова» Минздрава России; с 28 по 30 июня ;Министерство здравоохранения РФ, НМИЦ АГП им. В.И. Кулакова, Mediexpo;https://expomap.ru/conference/mat-i-ditja-2021/
ISC Frankfurt 2021 - международная конференция по суперкомпьютерам;Германия, Франкфурт , Messe Frankfurt; с 27 июня по 1 июля ;ISC Group;https://expomap.ru/conference/isc-frankfurt-2021/
Servparc 2021 - конференция по управлению, промышленным услугам и IT-решениям;Германия, Франкфурт; с 30 июня по 1 июля ;Mesago Messe Frankfurt GmbH;https://expomap.ru/conference/servparc-2021/
Intenational Symposium on Mineral Nutrition of Fruits Crops 2021 - международный симпозиум здорового питания;Израиль, Иерусалим , Yearim Hotel; с 27 июня по 1 июля ;ORTRA Ltd.;https://expomap.ru/conference/intenational-symposium-on-mineral-nutrition-of-fruits-crops-2021/
International Society of Heart Research Meeting (ISHR) EU 2021 - собрание международного общества исследования болезней сердца;Италия, Турин; с 29 июня по 2 июля ;International Society of Heart Research;https://expomap.ru/conference/international-society-of-heart-research-meeting-ishr-eu-2021/
Project Management Forum 2021 - всероссийский форум по проектному управлению;Россия, Москва , Холидей Инн Москва Сущевский; с 1 по 2 июля ;Interforum;https://expomap.ru/conference/project-management-forum-2021/
African Smart Cities Summit 2021 - саммит умных технологий для городского хозяйства;Южно-Африканская Республика, Йоханнесбург; с 29 июня по 2 июля ;DMG Events;https://expomap.ru/conference/african-smart-cities-summit-2021/
London Affiliate Conference (LAC) 2021 - конференция маркетинга и партнерских программ;Великобритания, Лондон , ExCeL London; с 3 по 6 февраля с 30 июня по 3 июля ;iGB Affiliate;https://expomap.ru/conference/london-affiliate-conference-lac-2021/
Moscow Urban Forum 2021 - международный конгресс градостроительства, архитектуры, экономики и стратегического планирования городов;Россия, Москва , Зарядье; с 1 по 4 июля ;АНО «Московский урбанистический форум»;https://expomap.ru/conference/moscow-urban-forum-2021/
Conference on Hypertension & Cardio Metabolism 2021 - международная конференция по гипертонии и сердечно-сосудистым заболеваниям;Великобритания, Лондон; с 5 по 6 июля ;Pulsus Group;https://expomap.ru/conference/conference-on-hypertension-cardio-metabolism-2021/
eTailing Summit 2021 - саммит по электронной коммерции (оффлайн+онлайн);Великобритания, Лондон; 11 февраля 2021 7 июля 2021 ;Forum Events Ltd;https://expomap.ru/conference/etailing-summit-2021/
Microscience Microscopy Congress (MMC) 2021 - конференция по микроскопии, научным исследованиям и технологиям;Великобритания, Манчестер , Manchester Central; с 5 по 8 июля ;Royal Microscopical Society;https://expomap.ru/conference/microscience-microscopy-congress-mmc-2021/
Восточный нефтегазовый форум 2021 - международный инвестиционный форум и выставка;Россия, Владивосток; с 7 по 8 июля ;Vostock Capital;https://expomap.ru/conference/vostochnyj-neftegazovyj-forum-2021/
Nigeria Oil and Gas Conference & Exhibition (NOG) 2021 - конференция и выставка нефтегазовой индустрии;Нигерия, Абуджа; с 5 по 8 июля ;DMG Events;https://expomap.ru/conference/nigeria-oil-and-gas-conference-exhibition-nog-2021/
International Conference on Software Engineering, Artificial Intelligence, Networking and Parallel/Distributed Computing (SNPD) 2021 - международная конференция по программной инженерии, искусственному интеллекту, сетевым технологиям и параллельным / распределенным вычислениям;Тайвань, Тайчжун , National Chin-Yi University of Technology; с 7 по 9 июля ;International Association for Computer and Information Science (ACIS);https://expomap.ru/conference/international-conference-on-software-engineering-artificial-intelligence-networking-and-paralleldistributed-computing-snpd-2021/
Asset Recovery LatAm 2021 - международная выставка финансов и судебной защиты;Бразилия, Сан-Паулу; с 8 по 9 июля ;Informa;https://expomap.ru/conference/asset-recovery-latam-2021/
Безопасность на транспорте 2021 - международный форум;"Россия, Санкт-Петербург , КВЦ ""Экспофорум"""; с 8 по 9 июля ;Conference Point;https://expomap.ru/conference/bezopasnost-na-transporte-2021/
Налогообложение холдинговых структур: оптимизация и риски 2021;Россия, Москва; 9 июля 2021 ;CFO-Russia, группа Prosperity Media;https://expomap.ru/conference/nalogooblozhenie-holdingovyh-struktur-optimizatsija-i-riski-2021/
Nanotexnology Conference 2021 - международная конференция по нанотехнологиям, органической электронике и устройствам;Греция, Салоники; с 3 по 10 июля ;TIF HELEXPO SA - Thessaloniki International Exhibition & Congress Centre;https://expomap.ru/conference/nanotexnology-conference-2021/
An Event Apart Washington DC 2021 - конференция для веб-разработчиков;США, Вашингтон , Washington Marriott Wardman Park; с 12 по 14 июля ;An Event Apart LLC;https://expomap.ru/conference/an-event-apart-washington-dc-2021/
Здоровье нации – основа процветания России 2021 - всероссийский форум;Россия, Москва , Гостиный Двор; с 13 по 15 июля ;Общероссийская общественная организация «Лига здоровья нации»;https://expomap.ru/conference/zdorovie-natsii-osnova-protsvetaniya-rossii-2021/
International Wood Construction Forum Paris 2021 - международный форум деревянного домостроения;Франция, Париж , Grand Palais; с 15 по 17 июля ;Forum Bois Construction;https://expomap.ru/conference/international-wood-construction-forum-paris-2021/
ISC West 2021 - конференция по безопасности;США, Лас-Вегас , Sands Expo & Venetian; с 23 по 26 марта с 19 по 21 июля ;Reed Exhibitions USA;https://expomap.ru/conference/isc-west-2021/
IAFP Meeting 2021 - конференция по безопасности и качеству продуктов питания;США, Финикс , Phoenix Convention Center; с 18 по 21 июля ;DSM Corporate, International Association for Food Protection (IAFP);https://expomap.ru/conference/iafp-meeting-2021/
World Mining Congress 2021 - конгресс по добыче полезных ископаемых;Австралия, Брисбен , brisbane-convention-exhibition-centre; с 19 по 22 июля ;CSIRO;https://expomap.ru/conference/world-mining-congress-2021/
The Special Event (TSE) 2021 - конференция и выставка индустрии специальных событий;США, Майами , Miami Beach Convention Center; с 19 по 22 января с 19 по 22 июля ;Penton;https://expomap.ru/conference/the-special-event-tse-2021/
Game Developers Conference (GDC) 2021 - конференция разработчиков игр;США, Сан-Франциско; с 19 по 23 июля ;Informa Markets;https://expomap.ru/conference/game-developers-conference-gdc-2021/
PMA Foodservice 2021 - международная конференция и выставка продуктов питания и напитков;США, Монтерей; с 23 по 24 июля ;Produce Marketing Association (PMA) USA;https://expomap.ru/conference/pma-foodservice-2021/
International Conference on Computer Science Networks and Information Technology (ICCSNIT) 2021 - международная конференция по компьютерным сетям и информационным технологиям;Канада, Монреаль , University of Quebec; с 30 по 31 июля ;Innovative Research Publication;https://expomap.ru/conference/international-conference-on-computer-science-networks-and-information-technology-iccsnit-2021/
International Conference on Structural Civil and Architectural Engineering (ICSCAE) 2021 - международная конференция по структурному гражданскому и архитектурному проектированию;Канада, Монреаль , University of Quebec; с 30 по 31 июля ;Innovative Research Publication;https://expomap.ru/conference/international-conference-on-structural-civil-and-architectural-engineering-icscae-2021/
Мировой конгресс международного фонда расщелины губы и нёба 2021 - конгресс реконструктивной хирургии лица, головы и шеи;Россия, Санкт-Петербург; с 30 июля по 1 августа ;ООО «Мономакс»;https://expomap.ru/conference/mirovoj-kongress-mezhdunarodnogo-fonda-rasscheliny-guby-i-neba-2021/
Forum Deutscher Mittelstand 2021 - конференция по цифровым технологиям;Германия, Штутгарт , ICS Internationales Congresscenter Stuttgart; с 3 по 4 марта с 3 по 4 августа ;IPM AG;https://expomap.ru/conference/forum-deutscher-mittelstand-2021/
Global Blockchain Summit 2021 - международный практический саммит по блокчейн технологиям и криптовалюте;США, Денвер; с 4 по 5 августа ;Mania Events;https://expomap.ru/conference/global-blockchain-summit-2021/
Tanzania Oil & Gas Congress 2021 - нефтегазовый конгресс;Объединенная Республика Танзания, Дар-эс-Салам; с 4 по 5 августа ;DMG Events;https://expomap.ru/conference/tanzania-oil-gas-congress-2021/
Такси 2021 - международный евразийский форум таксомоторной отрасли;Россия, Москва; с 5 по 6 августа ;АНО «МЕФТ»;https://expomap.ru/conference/taxi-2021/
Buona Estetika 2021 - международный конгресс эстетики и здоровья;Аргентина, Буэнос-Айрес; с 7 по 8 августа ;BUONAESTETIKA;https://expomap.ru/conference/buona-estetika-2021/
Внутренний контроль и внутренний аудит как инструменты повышения эффективности бизнеса. Август 2021 - конференция;Россия, Москва; 12 августа 2021 ;CFO-Russia, группа Prosperity Media;https://expomap.ru/conference/vnutrennij-kontrol-i-vnutrennij-audit-kak-instrumenty-povyshenija-effektivnosti-biznesa-august-2021/
IRGCE 2021 - международная конференция и выставка резиновых перчаток;Малайзия, Куала-Лумпур , Kuala Lumpur Convention Centre; с 11 по 13 августа ;Malaysian Rubber Glove Manufacturers Association Malaysia;https://expomap.ru/conference/irgce-2021/
